id,transcription,translation,language,speaker_id,gender,duration,source,audio_path,audio_root
27479,Ke proteine ​​yeo e tšweletšwago ke sebete le mokotla wa yolk wa lesea leo le golago nakong ya boimana.  Boemo bjo bja proteine ​​bo a fokotšega ka morago ga pelego.,It is a protein produced by the liver and yolk sac of a developing baby during pregnancy.  This protein level decreases after birth.,pedi,8fcfd554591bc06e4a36aae14b0170f5f04c604a1a9f875e7dde2a180eea554f,Female,13.336000442504883,intron-MT,data/audio/intron/pedi/ad65b428fa4008c9c98ced14e455449b_LZBVVYas.wav,/home/azureuser/gabby_data_mls/Intron-Multimodal-Benchmarking/
24324,Kamorago ga kgwedi e tee le seripa  sa kgwedi tsa opareixene sekurufu seile satxwa lerapong gape latloxwa sepetleleng se tee cmc vellore,After one and half months of surgery the screws came out of the bone and removed by the same hospital cmc vellore.,pedi,96de8675ad2834b27aa3935932afa9fe5a1e469af24399b61cecca8682536b72,Female,12.482999801635742,intron-MT,data/audio/intron/pedi/f4286174202817e187c3ff39dda56aba_ouqwmNqw.wav,/home/azureuser/gabby_data_mls/Intron-Multimodal-Benchmarking/
26663,"Be o sena dikgopolo tše mpe gomme ke ile ka thoma ka bophelo bjo  bo tlwaelegilego. Ke be ke thabile ka go fola. Bjale, ke emišitše ka dihlare. E setše e le kgwedi e tee go feta. ","There were no negative thoughts and I started with normal life.  I was happy with recovery.  Now, I have stopped the medications.  Already one month over.",pedi,09700b6a04eb69234bd1dda0fc759f5530ab566e18353a8ca6364947df18c1c0,Female,15.836999893188477,intron-MT,data/audio/intron/pedi/a99c9302acd0c8f625809ff38b26ff2c_KsJmavCx.wav,/home/azureuser/gabby_data_mls/Intron-Multimodal-Benchmarking/
26846,"Ke tla leka go di araba ka mo go kgonegago.Kea leboga,Linda Lew Dumela ebile kea o amogela mo Chat Doctor. Ke maswabi ka seemo sa gago ebile ke nyaka go go hlohleletša bokamoso. ","I will try and answer them as best possible.Thank you,Linda Lew Hi Linda and welcome to Chat Doctor.  I am sorry about your condition and want to encourage you for future.",pedi,09700b6a04eb69234bd1dda0fc759f5530ab566e18353a8ca6364947df18c1c0,Female,16.030000686645508,intron-MT,data/audio/intron/pedi/85c3f5837ea40732bc25bde499005a9b_BoVRYuZV.wav,/home/azureuser/gabby_data_mls/Intron-Multimodal-Benchmarking/
19801,A máa tẹ̀síwájú láti béèrè fún àwùjọ níbi tí a ti lè gbé nínú ààbò.,We will continue to demand a society where we can live in security.,pedi,c409eb7d0749c91fcb87894a43bc2e8fca412e5b9d5ae6ed03b349e646bd672e,Female,8.515000343322754,intron-MT,data/audio/intron/pedi/1feb709fdddfbaee2b06e3fb2250c092_QP0pvw9S.wav,/home/azureuser/gabby_data_mls/Intron-Multimodal-Benchmarking/
19684,"Tsatsi le ke be ke swanetse go ya Portugal,be [ke so hwetse] pokuna yaka ya passport...","On the day I was to depart for Portugal, I still [hadn’t] received my passport...",pedi,85fed0bccf84347f7704c4f3f5fdbb7fe619821c5952acb5c44f2ddb9acce5b8,Female,5.066999912261963,intron-MT,data/audio/intron/pedi/01fff0cba80ea532ef334b6f3cbe4f21_NmiNY7Zt.wav,/home/azureuser/gabby_data_mls/Intron-Multimodal-Benchmarking/
24466,O swanetṣ̌e gore o hlole ke Oral PHYSICIAN ebile o gwetṣ̌e x-ray ge elegore wisdom tooth e gwetṣ̌agetṣ̌e impacted extraction  goswana etlo lokiṣ̌a bothata permanently.,You should consult an Oral Physician and get an x-ray done and if the wisdom tooth is found impacted extraction of the same will resolve the problem permanently.,pedi,0544de456b45856e417a2c18280639f6e573a31878ff61c6330efafc4fd9927c,Female,18.583999633789062,intron-MT,data/audio/intron/pedi/cfb05a657930788009c9dd059182f1fd_mw1G0DyL.wav,/home/azureuser/gabby_data_mls/Intron-Multimodal-Benchmarking/
21589,"Ka fao o bile le yona e dirilwego pele, o rile?","So you've had it done before, you said?",pedi,42c750a84ffb04f371a5b7b0e8bf99027bc5d0e6b8f8cc4a7aae2fd9d011e7d0,Female,4.2729997634887695,intron-MT,data/audio/intron/pedi/43156f59dfa3c1ea675a0dc1e09007b3_uT6c59ZT.wav,/home/azureuser/gabby_data_mls/Intron-Multimodal-Benchmarking/
21822,"Ka fao, dingongorego tša gago ke dife lehono?","So, what's your complaints today?",pedi,d5eb9c48f25f8ce435c4d1659dd15e79ed6975397d2aa8b381e99afa137b8a57,Female,5.824999809265137,intron-MT,data/audio/intron/pedi/c6298ed5154a1372e76576a2e403ae3e_X861NDmK.wav,/home/azureuser/gabby_data_mls/Intron-Multimodal-Benchmarking/
23158,Ka lebaka la esiti ya ka mpheng gokwagala eke etla godimo ebile e hlola dika Txe dingwe. Eka hlola gape le segohlolo le go ikwa osa kgone go hema ,Because of this the acid of the stomach tends to come up and cause the symptoms.  It may also cause cough and sens sensation of breathlessness.,pedi,96de8675ad2834b27aa3935932afa9fe5a1e469af24399b61cecca8682536b72,Female,10.288000106811523,intron-MT,data/audio/intron/pedi/7837e57bfda9d0312c7d16bdf5479438_ai8aud3P.wav,/home/azureuser/gabby_data_mls/Intron-Multimodal-Benchmarking/
21600,Leina laka ke Ngaka Olowu gomme ke tla ba ngaka ya lena lehono.,My name is Doctor Olowu and I'll be your doctor for today.,pedi,42c750a84ffb04f371a5b7b0e8bf99027bc5d0e6b8f8cc4a7aae2fd9d011e7d0,Female,4.86299991607666,intron-MT,data/audio/intron/pedi/7e708b37c1744be028e2627aa03685e3_wfIASYoo.wav,/home/azureuser/gabby_data_mls/Intron-Multimodal-Benchmarking/
27480,"Kgatelelo ya monagano e ka direga ka kgatelelo ya ka mehla, gomme gape e ka direga ka tsela ya thutaphedi ntle le kgatelelo le ge e le efe le yona.  O hloka kalafo e swanetšego bakeng sa se se swanago.","Depression can occur with regular stress, and it can also occur biologically without any stress as well.  You need proper treatment for the same.",pedi,8fcfd554591bc06e4a36aae14b0170f5f04c604a1a9f875e7dde2a180eea554f,Female,15.843000411987305,intron-MT,data/audio/intron/pedi/3e2588c429086d0e80b8e0958b59bb4f_S6rSRbnr.wav,/home/azureuser/gabby_data_mls/Intron-Multimodal-Benchmarking/
19687,"Aka hwetsa selo mo ,lebaka ke gore ke Ile Ka thoma go nyakisisa Ka kamano ya Trump go Farage,mo khamphani ye ebitswago Cambridge Analytica.","And I only found out anything about this dark underbelly because I started looking into Trump's relationship to Farage, into a company called Cambridge Analytica.",pedi,85fed0bccf84347f7704c4f3f5fdbb7fe619821c5952acb5c44f2ddb9acce5b8,Female,8.857000350952148,intron-MT,data/audio/intron/pedi/83eb03ef5955fd6329235c6e75cd97e4_BogzcfQd.wav,/home/azureuser/gabby_data_mls/Intron-Multimodal-Benchmarking/
21695,"Aowa, ga ke na go ruruga le ge e le gofe.","No, I don't have any swelling.",pedi,d5eb9c48f25f8ce435c4d1659dd15e79ed6975397d2aa8b381e99afa137b8a57,Female,6.627999782562256,intron-MT,data/audio/intron/pedi/4052c9f8ab18ff6848bd7b246d668b97_jhvypkXQ.wav,/home/azureuser/gabby_data_mls/Intron-Multimodal-Benchmarking/
23387,"Jwalo oebeya kagare ga faele ya lebakanyana, ke ye xweu ka mmala. Ebile ke beyakantxe kopano ya beke Txe tharo gotloga ga bjale",He then put in a temporary filling.  It is very white in color.  So I scheduled an appointment for 3 weeks from now.,pedi,96de8675ad2834b27aa3935932afa9fe5a1e469af24399b61cecca8682536b72,Female,10.541000366210938,intron-MT,data/audio/intron/pedi/c91392ad289d91bb2fffdf7a2e73b06f_SFB7JAkJ.wav,/home/azureuser/gabby_data_mls/Intron-Multimodal-Benchmarking/
27384,"Maabane ke ile ka ikwa ke babja go fihla ka mpeng ya ka , ke be ke lapile dibeke tše ka bago tše 2 bjale, ke be ke na le hlogo ye bofefo kudu- e nyakile go kwagala bjalo ka bohloko bja hlogo ye bofefo.","Yesterday i felt sick to my stomach , have been tired for about 2 weeks now, was very light headed- almost felt like a light head ache.",pedi,8fcfd554591bc06e4a36aae14b0170f5f04c604a1a9f875e7dde2a180eea554f,Female,13.666000366210938,intron-MT,data/audio/intron/pedi/4283d5ed482ec4e3111a785dbdbecf76_VIUUuTBK.wav,/home/azureuser/gabby_data_mls/Intron-Multimodal-Benchmarking/
19748,"Ee,swanetse abe mo ,Ka boyena.","Yes, he must be here himself, personally.",pedi,85fed0bccf84347f7704c4f3f5fdbb7fe619821c5952acb5c44f2ddb9acce5b8,Female,9.031999588012695,intron-MT,data/audio/intron/pedi/b955aab0124f3ea6b22be2cae912ebf1_xZLKV1Ea.wav,/home/azureuser/gabby_data_mls/Intron-Multimodal-Benchmarking/
19741,"Mara nako ye ke SA le mahlalagading,moepo WA malahla le wa ditshipi etswaletswe,motse Ka Moka WA ba kgakanegong.","But when I was a teenager, the coal mines and the steelworks closed, and the entire area was devastated.",pedi,85fed0bccf84347f7704c4f3f5fdbb7fe619821c5952acb5c44f2ddb9acce5b8,Female,8.982999801635742,intron-MT,data/audio/intron/pedi/83b1b4b385992c5e73b6480ab42d4a33_88q7TN9q.wav,/home/azureuser/gabby_data_mls/Intron-Multimodal-Benchmarking/
19744,Rea tseba gore Gona le barutwana ba balego kotsing ya go lahlegelwa ke ngwaga Ka moka WA dithuto tsa bona.,We know that there's a generation of students at risk of losing an entire year of their education.,pedi,85fed0bccf84347f7704c4f3f5fdbb7fe619821c5952acb5c44f2ddb9acce5b8,Female,7.177999973297119,intron-MT,data/audio/intron/pedi/39399cf8e47d0516e81ac8598ec423d1_GALTzlve.wav,/home/azureuser/gabby_data_mls/Intron-Multimodal-Benchmarking/
23142,Zwswa ke leboga potxixo yagago mo poledisanong yagago le ngaka. Ke kwixixa seemo sagago le bothata. Seka sagago ke sona seleng go mexifa le marapo ka lebaka la moxomo WA gago,zeswa Thanks for your question on Chat Doctor.  I can understand your situation and problem.  Your symptoms are mostly due to musculoskeletal cause because of your work.,pedi,96de8675ad2834b27aa3935932afa9fe5a1e469af24399b61cecca8682536b72,Female,12.095000267028809,intron-MT,data/audio/intron/pedi/2a47597310b07ed80cff87ef62a76909_PlECREa4.wav,/home/azureuser/gabby_data_mls/Intron-Multimodal-Benchmarking/
27114,Go efoga se-O swanetše go Boledišana le Ngaka ya Pelo- gomme o nyakišišwe bakeng sa lipid profile le teko ya kgateletšego/ Thallium Nuclear Scan e ka nyakega tabeng ya gago. ,To avoid this-You need to Consult Cardiologist- and get investigated for lipid profile and stress test/ Thallium Nuclear Scan may be needed in your case.,pedi,bb570654edb3c811928f0f17854558c5cf3db5aed2d2de546702f2128bf4b61e,Female,12.267000198364258,intron-MT,data/audio/intron/pedi/ae95f28ad8e2209ec08ae4975f5afe93_W7EN0Hnq.wav,/home/azureuser/gabby_data_mls/Intron-Multimodal-Benchmarking/
19795,"Mna Ali o boletše gore dipego tšeo di fihlago ntlokgolo go tšwa go Ditaelo di bontšha gore, bahlankedi ba ditseno ba be ba rotogela godimo go tlhohlo ya mošomo wa bona wa profeshenale ka go boloka maemakepe a maemakepe a šoma.","Mr Ali said reports reaching the Headquarters from the Commands indicate that, Customs operatives have been rising to the challenge of their professional calling by keeping the Seaports functional.",pedi,c409eb7d0749c91fcb87894a43bc2e8fca412e5b9d5ae6ed03b349e646bd672e,Female,27.701000213623047,intron-MT,data/audio/intron/pedi/6e0de4630f4413fc8405484deb4319e2_do1Jbf2T.wav,/home/azureuser/gabby_data_mls/Intron-Multimodal-Benchmarking/
16803,"Eupya go sepela diiri txe nne GA go eletxwe, legend of ka efoga jerk. Go kgethwa kudu go fetolxa modudi wa gago go feta go txea leeto le letelele txatxi ka txatxi","But traveling for 4 hours is not advisable, even if you avoid jerks.  Its more preferable to change your residence than to have a long journey daily.",pedi,ee4e9b3093b8931f521cab8f0d37b610d33c223c2d73a0e80f177dd69d34e1b2,Female,17.81100082397461,intron-MT,data/audio/intron/pedi/ca56908610bc0bcbfd1a01330e00157e_jIRDcX2W.wav,/home/azureuser/gabby_data_mls/Intron-Multimodal-Benchmarking/
19631,Ma ụmụ irighiri ihe bụ ndị na-akọ akụkọ banyere ihe nzuzo anyị n 'otu aka.,And molecules are the storytellers of our secrets in just a touch.,pedi,bb70ab62c65ce256eda5d9115e17ffa5398e8b4a22522d06adaf2690201c82d4,Female,6.520999908447266,intron-MT,data/audio/intron/pedi/9fe80766c38bc7d65a835858aaada0a3_aG149CQM.wav,/home/azureuser/gabby_data_mls/Intron-Multimodal-Benchmarking/
27478,Morwa waka yo a nago le mengwaga ye senyane o be a dutše a ngongorega ka dihlabi tša ka mpeng.  Se se thomile dibeke tše tharo tše di fetilego ka morago ga ge a hweditše di-brace.,my son who is 9 years old has been complaining about stomach aches.  This started three weeks ago after he got braces.,pedi,8fcfd554591bc06e4a36aae14b0170f5f04c604a1a9f875e7dde2a180eea554f,Female,12.980999946594238,intron-MT,data/audio/intron/pedi/edc626caa5c57a1546ab0fdb1c217b55_6ftzvT5A.wav,/home/azureuser/gabby_data_mls/Intron-Multimodal-Benchmarking/
22547,Mosadi waka ona le leswilka la silikalas yago lekana di milimitara Txe masome pedi nne ka gare ga kalbolada  okwa bohloko ka letsogong la go ja Goya godimo ga abodomene gotloga matxatxing a xupa agofeta,"My wife have a clculus stone 24 mm in gallblader, she have pain in right hand side of upper abdomen from last 7days.",pedi,96de8675ad2834b27aa3935932afa9fe5a1e469af24399b61cecca8682536b72,Female,16.180999755859375,intron-MT,data/audio/intron/pedi/14efe81e2a34e7f8952bdc3657067c55_aevjFHAk.wav,/home/azureuser/gabby_data_mls/Intron-Multimodal-Benchmarking/
25957,Diteko Txe pedi txa bjale di boncha go nyoga ga biluribini lemadi ka gare ga mohlapologo waka empa txhomo godimo ya sebete gase ya boncha selo. Ebe ele kgweding Txe lesome txa go feta. Gabjale re hudugetxe lefelong le lesfsa,Two recent blood tests showed elevated bilirubin and blood in my urine but a liver work up showed nothing.  That was about 10 months ago.We recently moved to a new state.,pedi,96de8675ad2834b27aa3935932afa9fe5a1e469af24399b61cecca8682536b72,Female,17.441999435424805,intron-MT,data/audio/intron/pedi/285bea482371d3fa5c910d9d3e071a53_KPdq5COV.wav,/home/azureuser/gabby_data_mls/Intron-Multimodal-Benchmarking/
21673,Ka ngwaga wo o fetileng fela.,For about a month now.,pedi,42c750a84ffb04f371a5b7b0e8bf99027bc5d0e6b8f8cc4a7aae2fd9d011e7d0,Female,3.63700008392334,intron-MT,data/audio/intron/pedi/2df1789e08500322346fd770a0d892c4_Y0nbBQ3p.wav,/home/azureuser/gabby_data_mls/Intron-Multimodal-Benchmarking/
27382,"Dika tša boimana bjalo ka go nyema moko, go hlatša,go rota mo go oketšegilego, matswele a bohloko a thoma gona kua dibekeng tše 6 tša boimana.  Ka ge o be o sa hwetše dinako go boima kudu go bolela e sa le pele.","The symptoms of pregnancy like nausea, vomiting,increased urination, sore breasts start around 6 weeks of pregnancy.  As you didn't get the periods it is very difficult to predict.",pedi,8fcfd554591bc06e4a36aae14b0170f5f04c604a1a9f875e7dde2a180eea554f,Female,16.507999420166016,intron-MT,data/audio/intron/pedi/93a6938ae7510eb688c24e83a1cb6fd8_fD3Q5gmc.wav,/home/azureuser/gabby_data_mls/Intron-Multimodal-Benchmarking/
21782,"Esego kannete, gase ra itukišetša go ba le ngwana gona bjale.","Not really, we didn't plan to have a baby now",pedi,4072f4a3da03ce72c2451e36777658c98bdd6f4b2efe4f9457bd6b31e62696fd,Female,6.210000038146973,intron-MT,data/audio/intron/pedi/d381b2c6d0f1df7a2d99170046d373ac_NyPgvUlq.wav,/home/azureuser/gabby_data_mls/Intron-Multimodal-Benchmarking/
19715,Hlatholla setsopolwa SA nnete,Translation Original Quote,pedi,85fed0bccf84347f7704c4f3f5fdbb7fe619821c5952acb5c44f2ddb9acce5b8,Female,2.492000102996826,intron-MT,data/audio/intron/pedi/3d5049ec6fd2696285e887d5d8c91cfe_pG3QWz0r.wav,/home/azureuser/gabby_data_mls/Intron-Multimodal-Benchmarking/
26524,"Ke nale asthma  ebile ke gohlola Madi,eseng ge ke gohlola ka kudu.se sediragetṣ̌e ga raro mo mafelelong a dikgwedi tṣ̌e tshela tṣ̌ao feta ","I have asthma and am coughing up some blood .  Not when I m coughing hard, just a one time cough.  This has happened 3 times in the last 6 months.",pedi,0544de456b45856e417a2c18280639f6e573a31878ff61c6330efafc4fd9927c,Female,13.875,intron-MT,data/audio/intron/pedi/ee741e300986c59596d57a166a68daf4_Lqkhtvg8.wav,/home/azureuser/gabby_data_mls/Intron-Multimodal-Benchmarking/
19638,– hayupo kwenye kituo cha redio,– he's not at the radio station,pedi,bb70ab62c65ce256eda5d9115e17ffa5398e8b4a22522d06adaf2690201c82d4,Female,4.083000183105469,intron-MT,data/audio/intron/pedi/4a544765dbcf7f739689db84c2701f3d_ZvzvNU6V.wav,/home/azureuser/gabby_data_mls/Intron-Multimodal-Benchmarking/
19723,"Empa moetapele WA Fulham orile:"" Ke yena WA Pele WA go nromela molaetsa WA gore ""o amogetswe"".",But the Fulham manager said: “He was the first who sent me a message to say ‘welcome back’.,pedi,85fed0bccf84347f7704c4f3f5fdbb7fe619821c5952acb5c44f2ddb9acce5b8,Female,5.701000213623047,intron-MT,data/audio/intron/pedi/a624de8a10eb030169b1042c1d951ed9_NbCYp5Eq.wav,/home/azureuser/gabby_data_mls/Intron-Multimodal-Benchmarking/
19728,"Ge ke lebella TSE Di ndikaneditsego bjale,ke bona lefelo le lengwe le lengwe bjalo Ka monyetla.","If I look around now, I see every surface as an opportunity.",pedi,85fed0bccf84347f7704c4f3f5fdbb7fe619821c5952acb5c44f2ddb9acce5b8,Female,6.177000045776367,intron-MT,data/audio/intron/pedi/2c39e322478a27bf0f43af00e1d363c8_rR80ZthI.wav,/home/azureuser/gabby_data_mls/Intron-Multimodal-Benchmarking/
21865,"Go lokile, naa o ile wa mofa se sengwe sa go mo thusha ka seemo sa leratadima?",OK Did you give him anything to help with this temperature?,pedi,66f87ffa7ebb73d4c67cfcf00fda7337ba205a0988dff7a9d26347926eb7b45f,Female,6.961999893188477,intron-MT,data/audio/intron/pedi/d18dde2806438ac2c24a91c4e8de803e_UEu8BUmY.wav,/home/azureuser/gabby_data_mls/Intron-Multimodal-Benchmarking/
21630,"Lekope le le tla re botša gore ke mohuta ofe wa seterouku, ge e le gore ke seterouku, ke mohuta ofe wa seterouku? Ka gobane ke na le baanegwa ba babedi. Tshwarelo, ga se ka hwetša seo.","And this scan will tell us what kind of stroke, if it's a stroke, what kind of stroke is it? Because basically I have two types. Sorry, I didn't get that.",pedi,42c750a84ffb04f371a5b7b0e8bf99027bc5d0e6b8f8cc4a7aae2fd9d011e7d0,Female,15.824000358581543,intron-MT,data/audio/intron/pedi/0e79c9790bc9a83f333d37b32cd29b36_gb3lZVzz.wav,/home/azureuser/gabby_data_mls/Intron-Multimodal-Benchmarking/
19693,"Go feta iri,obe a emeletse Alamu Ka Di potsiso gotswa go molaodi, bofelong Adio athoma go botsisa di potsiso,go moemedi WA Alamu,na go Sena motho yo asatsebego Ka kgoro tsheko gore molato ofela bjang. Dipotsiso TSA Gona Di be Di le bogale,Di nyakisisa,Di tseneletse.","For over one hour, he stood by Alamu as the barrage of questions came pouring in from the opponent’s lawyer, and when at last Adio started his own cross-examination of Alamu's opponent, nobody present in court was in any doubt as to where the axe would fall. The cross examination was rigorous, it was searching, it was through:",pedi,85fed0bccf84347f7704c4f3f5fdbb7fe619821c5952acb5c44f2ddb9acce5b8,Female,17.641000747680664,intron-MT,data/audio/intron/pedi/98844ca7bf647cddd1b85e67439e4e88_dEby4k2a.wav,/home/azureuser/gabby_data_mls/Intron-Multimodal-Benchmarking/
21800,"Ee, ee.  Go lokile.  Go lokile gona.  Oo, ke a bona.","Yes, yes. Alright. Okay then. Oh, I see.",pedi,d5eb9c48f25f8ce435c4d1659dd15e79ed6975397d2aa8b381e99afa137b8a57,Female,11.295000076293945,intron-MT,data/audio/intron/pedi/c34373d1ce575dd96b26d2cde198ac4c_5phLks6l.wav,/home/azureuser/gabby_data_mls/Intron-Multimodal-Benchmarking/
27253,Ga go le e tee go fihla ga bjale.  Re gatelelwa ke sekolo eupša morwa wa ka o sa hwetša di-A tša magareng le di-B.  Bothata fela ke diteko tša gagwe (dipalo) tšeo e lego di-D le Di-F,None so far.  We are being pressured by school but my son is still getting average a's and b's.  The only problem is his tests (math) which are d's and f's.,pedi,8fcfd554591bc06e4a36aae14b0170f5f04c604a1a9f875e7dde2a180eea554f,Female,20.958999633789062,intron-MT,data/audio/intron/pedi/19241849c3b0c437a047a6bdf8bad760_F9ZPvwqf.wav,/home/azureuser/gabby_data_mls/Intron-Multimodal-Benchmarking/
21694,"Go lokile, ke na le go khohlela mo go swana le matšatši a mabedi bjale.","Well, I've been having this cough for like 2 days now.",pedi,d5eb9c48f25f8ce435c4d1659dd15e79ed6975397d2aa8b381e99afa137b8a57,Female,9.017000198364258,intron-MT,data/audio/intron/pedi/19b302bae039b71ef21e6e948923b54e_9nBWkC8j.wav,/home/azureuser/gabby_data_mls/Intron-Multimodal-Benchmarking/
27174,"ke bile le thobalano yeo e sa šireletšwago ka di 8 tša march gomme ex yaka e rothile ka go nna, ke tšere diteko tše 3 tša boimana tša ka gae le teko ya madi eupša ka moka di boile di sa thabišego.","i had unprotected intercourse on the 8th of march and my ex ejaculated in me, i've taken 3 home pregnancy tests and a blood test but they all came back negative.",pedi,822a22cd3fd1e6ab0724aee91cf08813175f2b8f20b64a344d54bb52a02f58f1,Female,21.093000411987305,intron-MT,data/audio/intron/pedi/4ae83983f6b7cc9bbb930b8ab822670e_xivB5081.wav,/home/azureuser/gabby_data_mls/Intron-Multimodal-Benchmarking/
22385,"Dumela, ke nna Bhargav go tšwa Mumbai. Ke dirile tekolo ya dipshio go lekola mošomo wa tšona ka Phupunj 2010. Ka nako yeo, mphio ya ka ya le letshadi e be e šoma ka diperesente tše 23%, gomme ya le letona e be e šoma ka diperesente tše 73%.

","hi i am Bhargav from mumbai, i had a kidney scan done for its function in June 2010, at that time the left kidney functioned around 23% and right funtioned 73%.",pedi,47635173c6270576d26e22f002e7474cb2bb17a826193a1e0462f27ab1710d60,Female,21.91699981689453,intron-MT,data/audio/intron/pedi/4450df39069c9e0d5403f53c6cfea3cf_ILxWM7Hr.wav,/home/azureuser/gabby_data_mls/Intron-Multimodal-Benchmarking/
21755,Go lokile.  Na o kgona go bona gabotse?  Naa o na le bothata bja go se bone...?,All right. Can you see properly? Are you having any visual erm…?,pedi,d5eb9c48f25f8ce435c4d1659dd15e79ed6975397d2aa8b381e99afa137b8a57,Female,9.795999526977539,intron-MT,data/audio/intron/pedi/cd7a749a2c46bca8e860e8c922d9beaf_gl41kiyr.wav,/home/azureuser/gabby_data_mls/Intron-Multimodal-Benchmarking/
21676,Seo se na le kgwedi se direga.,That has been going on for a month.,pedi,42c750a84ffb04f371a5b7b0e8bf99027bc5d0e6b8f8cc4a7aae2fd9d011e7d0,Female,3.3459999561309814,intron-MT,data/audio/intron/pedi/95dd72d9d72a75b5577b74888fe4f7c0_os9v3aKD.wav,/home/azureuser/gabby_data_mls/Intron-Multimodal-Benchmarking/
26672,"Dumela ke kwa phefo kudukudu, ebile le go gohlola go gona. Ke na le mengwaga ye 27, 169 cm ka seemo, sehlopa sa madi aka ke A+, ke imela 61 kg. ","Hi I am feeling too cold, and a cough is there.  I am 27 years old, 169 cm height, blood group A+, and weight 61 kg.",pedi,09700b6a04eb69234bd1dda0fc759f5530ab566e18353a8ca6364947df18c1c0,Female,14.23799991607666,intron-MT,data/audio/intron/pedi/c8ed8e70e5682436f4d818a886a7da0f_Xpwuj2LF.wav,/home/azureuser/gabby_data_mls/Intron-Multimodal-Benchmarking/
27476,Na ke swanetše go bea phetse godimo ga lethopa ?  Ga ke tsebe. ka kgopela a Na oka fana ka keletšo ye nngwe ?  Ditebogo tše dintši Rod Sayers.,Should I place a pad over the boil ?  I don t know.  Could you please offer some advice ?  Many thanks Rod Sayers.,pedi,8fcfd554591bc06e4a36aae14b0170f5f04c604a1a9f875e7dde2a180eea554f,Female,11.689000129699707,intron-MT,data/audio/intron/pedi/54a1afe7597b49f21ac7dfd09b2b1d57_fZveA1ui.wav,/home/azureuser/gabby_data_mls/Intron-Multimodal-Benchmarking/
27383,Ga ke kgone go dula kago otlologa goba go ema ntle le go ba le dihlabi tša sefuba gomme ka dikelela  bbad le go hlatša.  Eupša ge nka patlama fase e a nolofala ka tsela ye nngwe.  Ke na le go opša ke hlogo ka morago ga moo ,I cant sit up or stand without having chest pains and get dizzy bbad and nauseated.  But if I lay down it eases somewhat.  I have headaches afterwards too.,pedi,8fcfd554591bc06e4a36aae14b0170f5f04c604a1a9f875e7dde2a180eea554f,Female,18.259000778198242,intron-MT,data/audio/intron/pedi/ffb9897d3290b84342b6d5f77893aa61_lEgde6VQ.wav,/home/azureuser/gabby_data_mls/Intron-Multimodal-Benchmarking/
27111,"Antigen ya kankere 125 ke selo seo se tšweletšwago ka gare ga mae , diphaephe tša fallopian, popelo, molomo wa popelo le lera la sehuba le mašoba a ka mpeng (pleura le peritoneum).","Cancer antigen 125 is a substance that is produced in the ovary, fallopian tubes, uterus, cervix, and the lining of the chest and abdominal cavities (the pleura and the peritoneum).",pedi,bb570654edb3c811928f0f17854558c5cf3db5aed2d2de546702f2128bf4b61e,Female,14.279000282287598,intron-MT,data/audio/intron/pedi/70e56588d0d0200726a7de7a2f940dd9_3U4oMcLX.wav,/home/azureuser/gabby_data_mls/Intron-Multimodal-Benchmarking/
26680,"dingaka ga di tsebe gore go direga eng.o na le kgopolo? Thobela,matshwao a gago a šišinya e ka ba go fokotšega ga electrolyte goba leoto leo lesa iketlago.syn ngaka ya poledišano ","the doctors dont know what is going on.  do you have an idea?  Hi, your symptoms suggest either electrolyte depletion or restless leg syn Chat Doctor.",pedi,822a22cd3fd1e6ab0724aee91cf08813175f2b8f20b64a344d54bb52a02f58f1,Female,18.124000549316406,intron-MT,data/audio/intron/pedi/8522c78922cfa4e15490a27cc111c43f_H3E0QFEW.wav,/home/azureuser/gabby_data_mls/Intron-Multimodal-Benchmarking/
21754,"Bohloko bja ka mpeng?  Aowa, Aowa.","Abdominal pain? No, No.",pedi,d5eb9c48f25f8ce435c4d1659dd15e79ed6975397d2aa8b381e99afa137b8a57,Female,5.890999794006348,intron-MT,data/audio/intron/pedi/6e17121b7e61bba4a81e79b0b5ecedf6_v1ULCKCW.wav,/home/azureuser/gabby_data_mls/Intron-Multimodal-Benchmarking/
26669,"Ga go bohloko, lege e le gore ge ke nagana morago ke lemogile bothata bja go sepela go ya godimo go ba go namela manamelo lebakanyana","It does not hurt, although thinking back I have noticed difficulty walking up or getting up the stairs for a little while.",pedi,09700b6a04eb69234bd1dda0fc759f5530ab566e18353a8ca6364947df18c1c0,Female,9.949000358581543,intron-MT,data/audio/intron/pedi/3ab9fbbb5601ffac2713bf84889ab403_8iXPCqDq.wav,/home/azureuser/gabby_data_mls/Intron-Multimodal-Benchmarking/
