id,transcription,translation,language,speaker_id,gender,duration,source,audio_path,audio_root
25546,"هما اخدوني لغرفة الطوارئ عشان الوجع عندي كان جامد 
انا مكنتش قادر اتحرك
انا عملت رنين مغناطيسي 
بس لسا النتائج مطلعطش","I had to be taken to the ER because the pain was so bad, I could not move.  I had an MRI taken, but have not received the results yet.",arabic,d1d7103d39aed72e29f524ba03e5adcef1c2e0d738193b33160b92ac64794b70,Male,7.105000019073486,intron-MT,data/audio/intron/arabic/19a67462a2f8e4e8cde34413ccf3c254_tIifDqO5.wav,/home/azureuser/gabby_data_mls/Intron-Multimodal-Benchmarking/
17526,"كمان كان عندي غازات كتيره جدا في اخر يومين عدوا , خصوصا امبارح و اخدت سيميثيكون اللي ريحني شويه ",I have also had a lot of serious gas in the last two days mostly yesterday and have taken simethicone with little relief.,arabic,6757b2f7077bec53f7c77d25244249f12f66ae6c03fc3130030186554ce6edd2,Female,8.989999771118164,intron-MT,data/audio/intron/arabic/c3db1e56494dd496a8cc268c176c35a3_iOV5qyB1.wav,/home/azureuser/gabby_data_mls/Intron-Multimodal-Benchmarking/
25655,"راحت للدكتور لأن في وقت معين كانت بتحس إنها هتغمى عليها بسببه. الدكاترة عملوا لها تحليل دم وقالوا إن مفيش حاجة غلط.
",She went to the doctors because at one point she was passing out because of it the doctors took some blood test and said nothing is wrong.,arabic,2d711411f88439399349be87fa47ce0cd767a22694bfcfd717036dff579e3c25,Male,12.085000038146973,intron-MT,data/audio/intron/arabic/42a9b27a57e8114461a43d2fda3182fb_TghXCXdw.wav,/home/azureuser/gabby_data_mls/Intron-Multimodal-Benchmarking/
17530,تمام انا عندي حفيدي عنده 13 سنه و من اول ما اتولد و هو بيعاني من مشاكل كبيره . اتولد براس كبيره و كان مولود قبل معاده ب 8 اسابيع,Ok I have a 13 year old grandson that has had major problems from birth.  Born with a big head and 8 weeks early.,arabic,6757b2f7077bec53f7c77d25244249f12f66ae6c03fc3130030186554ce6edd2,Female,13.73799991607666,intron-MT,data/audio/intron/arabic/ac5bba2e41fcdcc8958f1ab05052486f_kxspeoUx.wav,/home/azureuser/gabby_data_mls/Intron-Multimodal-Benchmarking/
25552,انا كان عندي حمى فيروسية الأسبوع اللي فات ، وكملت دلوقتي علاجي اللي مدته اربع ايام وخدت بردو حقنة للحمى ,I was suffering for viral fever last week and just completed my 4-day course and had also taken an injection for fever.,arabic,6504a007ccd20956a222bb08bb2fb38aeb4e5b49e3712d7c427adcffb5724671,Female,8.694999694824219,intron-MT,data/audio/intron/arabic/f80f176783b0ce04e14ff942e161d282_ERTdSGH0.wav,/home/azureuser/gabby_data_mls/Intron-Multimodal-Benchmarking/
17647,أهلاً بيك في شات دكتور. أنا فاهم سؤالك وقلقك. الأعراض اللي عندك بتدل على جلطة في عضلة القلب أدت لفشل في الجانب الأيمن من القلب.,Hi welcome to ChatDoctorI understand your query and concern.  Your symptoms are suggestive of Myocardial infarction leading to Right sided heart failure.,arabic,f3aa2610507c8775f78760ae73e41edaada52f3216cb4ccd02e3ac4b71759e02,Male,10.8149995803833,intron-MT,data/audio/intron/arabic/c8fdf0106c7f4fc47d046e3b4ee763de_hZ5blyvN.wav,/home/azureuser/gabby_data_mls/Intron-Multimodal-Benchmarking/
17515,أنا محارب قديم وقضيت الكريسماس من 8 سنين مع حصوة في الكلى ومتمناش دا يحصل تاني إلا لو اضطريت.,Im a Veteran and spent the Christmas with a kidney stone 8 years ago and don t wish to again unless I have to.,arabic,04280342e856481e1fd3c6fed4159259ed8a080619d1d1eec2a4011cd1b0e055,Female,8.562000274658203,intron-MT,data/audio/intron/arabic/7d31317870fb07a7169881c68cea69b5_MZmcB8cu.wav,/home/azureuser/gabby_data_mls/Intron-Multimodal-Benchmarking/
17534,اللون مش باين عليه انه غريب و مفيش ريحه وحشه و مش بشوف اي نقط زيت في قاعده الحمام . كل يوم بيكون كده,Colour does not seem abnormal and there is not a bad smell and I do not see oil drops in the toilet bowl.  Every morning I have this.,arabic,6757b2f7077bec53f7c77d25244249f12f66ae6c03fc3130030186554ce6edd2,Female,11.357000350952148,intron-MT,data/audio/intron/arabic/bd9c8d4ad1173fb13a9d1077d70ca186_9dFpHE1q.wav,/home/azureuser/gabby_data_mls/Intron-Multimodal-Benchmarking/
25548,"اهلا بيك في دردشة الدكتور 
انا هبقي مهتم ب تساؤلاتك و هفهم مشكلتك 
لو انت عندك مشكلة  مع النزيف 
يبقي انت بتتمشي كتير ",Welcome to Chat Doctor I have gone through your query and understand your concern.  As you have bleeding disorder.  You did a lot of walking.,arabic,d1d7103d39aed72e29f524ba03e5adcef1c2e0d738193b33160b92ac64794b70,Male,7.15500020980835,intron-MT,data/audio/intron/arabic/5bc6b9702f72259ab27e55d767e50c89_z72Rwuif.wav,/home/azureuser/gabby_data_mls/Intron-Multimodal-Benchmarking/
25623,"هما قلقانين من السرطان؟ أنا عندي ٤٣ سنة.
أهلاً بيك، أنا قريت سؤالك وفاهم قلقك. ممكن يكون عندها سرطان. ","are they worried about cancer? I m 43 Hi, dairy have gone through your question.  I can understand your concern.  She may have cancer.",arabic,042ba3da2966afb60793ed8577c8387bda702a6da40d30750155eec9a7edd5fe,Female,10.666999816894531,intron-MT,data/audio/intron/arabic/549b16978d409f96b8481f0a7dcf04cc_mLQdHkoM.wav,/home/azureuser/gabby_data_mls/Intron-Multimodal-Benchmarking/
17571,"يعني نقدر نستبعد التهاب الشعب الهوائية في حالتك. الأحسن إنك تراجع طبيب متخصص في الجهاز التنفسي وتعمل:

فحص سريري للجهاز التنفسي.1
اختبار وظائف الرئة (PUT).2",So we should rule out bronchitis in your case.  So better to consult pulmonologist and get done  1. Clinical examination of respiratory system  2. PUT (Pulmonary Function Test).,arabic,ae36dfa6e11ad83b7151b14aaa198b9a6416d83b621a23cbd5cd9faf15ef08a4,Male,16.31399917602539,intron-MT,data/audio/intron/arabic/969b6077713e49c0cc808c072ac622e6_vdb89MP9.wav,/home/azureuser/gabby_data_mls/Intron-Multimodal-Benchmarking/
25447,"
أعلم أن هناك شيئًا خاطئًا؛ لقد واجهت العديد من المشكلات. لقد تعافيت عقليًا من الحدث المؤلم بشكل جيد للغاية؛ على الرغم من أنه كان مروعًا جسديًا.",t. I know something is wrong; I have had so many problems.  The traumatic event I mentally have recovered very well; however physically horrible.,arabic,1fa52c0ab836b90434d5028740bdf8c18906dec60b442f0960575a6a9239b6ab,Female,11.715999603271484,intron-MT,data/audio/intron/arabic/58e7daa9ef38b75f682380e4209c9fb4_ymdUhbzj.wav,/home/azureuser/gabby_data_mls/Intron-Multimodal-Benchmarking/
25696,لو كان الطفل نشيط وبيلعب ومكنش عنده سخونية، فاحتمال يكون مرض فيروسي ومش محتاج مضادات حيوية خالص.,"If the kid is active and playing around when there is no fever, it is probably viral illness and it doesn't require antibiotics at all.",arabic,04280342e856481e1fd3c6fed4159259ed8a080619d1d1eec2a4011cd1b0e055,Female,7.730999946594238,intron-MT,data/audio/intron/arabic/d48c757ef90f7f3178cb88987c43cb10_WEjJ9eie.wav,/home/azureuser/gabby_data_mls/Intron-Multimodal-Benchmarking/
25556,برضو عشان النوبة دي حصلت بدري في حياته لازم نعمل فحوصات للسبب ومضاعفاته بشكل كامل ,"Also, since this episode has occurred so early in life, the cause and its effects on the urinary system needs to be thoroughly investigated.",arabic,6504a007ccd20956a222bb08bb2fb38aeb4e5b49e3712d7c427adcffb5724671,Female,7.999000072479248,intron-MT,data/audio/intron/arabic/7e53cbe5936a37747cd316a22ff0b4d8_s0hheRdT.wav,/home/azureuser/gabby_data_mls/Intron-Multimodal-Benchmarking/
25493,عملت اختبار وظائف الرئة واللى أظهر نتائج طبيعية. بعد ستة أشهر ظهرت لي الاعراض دى تانى ، وبعد فحصي من قبل طبيبي، اقترح أن الموضوع بيتعلق بالتهاب الشعب الهوائية.,I even got a PFT done which showed normal results.  Six months later I got those symptoms again and my doctor after examining me suggested it is bronchitis.,arabic,52bc77ac59201c1bc5f2188c619ccae938b1f747483af407869b3b73353fb827,Female,13.031000137329102,intron-MT,data/audio/intron/arabic/0ab2164867cfdb65c5fa56b6596dbafe_rzNWIBnh.wav,/home/azureuser/gabby_data_mls/Intron-Multimodal-Benchmarking/
25540,"الانتكاسة ممكن تحصل بعد ما تخف من حمي التيفويد 
عشان كدا انت لازم تكون حريص في نظام اكلك و تاكل اكل بيتي مسلوق او مطبوخ بزيت قليل ","After typhoid relapses can occur, so you should be very careful with your diet.  Take homemade nutritious food (boiled or cooked in little oil).",arabic,d1d7103d39aed72e29f524ba03e5adcef1c2e0d738193b33160b92ac64794b70,Male,9.404999732971191,intron-MT,data/audio/intron/arabic/a91e252489139fc67c855098e09408ec_oy1jCLnc.wav,/home/azureuser/gabby_data_mls/Intron-Multimodal-Benchmarking/
25642,أهلًا، عمري 27 سنة. بقالي 18 شهر بحاول أحمل. كل تحاليلي، بما فيهم اختبار HSg وPCR للسل كانت طبيعية,"Hi  I am 27 years old.I am trying to concieve since last 18 months.All my tests, including HSg and TB PCR test are notmal.",arabic,2d711411f88439399349be87fa47ce0cd767a22694bfcfd717036dff579e3c25,Male,18.361000061035156,intron-MT,data/audio/intron/arabic/275d82dc77ee6cba93d8210b6bffd814_HtF1Gihn.wav,/home/azureuser/gabby_data_mls/Intron-Multimodal-Benchmarking/
17540,رحت للدكتور من يومين بسبب ألم في البلع. مكنش عندي أي أعراض تانية، لا احتقان، ولا رشح، ولا التهاب في الحلق، كان بس ألم في البلع,"I saw a doctor two days ago due to painful swallowing.  I had no other ailments, no congestion, runny nose, or sore throat, simply painful swallowing.",arabic,a00da6d7ad33ec156776bf66a72158043afb1c02387ab355024822ecdcd096cb,Male,10.935999870300293,intron-MT,data/audio/intron/arabic/9cd051bfb6d932ef2de54269527ce4fe_vgJ1Jhvz.wav,/home/azureuser/gabby_data_mls/Intron-Multimodal-Benchmarking/
25614,عندي اتنين أطفال وأنا أم عزباء. شكرًا على سؤالك في دردشة الطبيب. أنا فاهمة وضعك ومشكلتك. في رأيي، لازم تستشيري طبيب أمراض صدرية وتعملي الفحوصات اللازمة.,I have 2 kids ima single mom.  Thanks for your question on Chat Doctor.  I can understand your situation and problem.  In my opinion you should consult pulmonologist and get done,arabic,2d711411f88439399349be87fa47ce0cd767a22694bfcfd717036dff579e3c25,Male,19.760000228881836,intron-MT,data/audio/intron/arabic/d2395fd9bba8cbd67fe74174e3d554ae_4sOtrnJl.wav,/home/azureuser/gabby_data_mls/Intron-Multimodal-Benchmarking/
25458,بمجرد تأكيد الإصابة، من المهم علاجها بالجراحة ثم الحصول على العلاج الكيميائي والعلاج الإشعاعي لقتل الخلايا المتبقية في الرئتين.,Once it is confirmed then it is important to get it treated by surgery and then get chemotherapy and radiation therapy to kill the leftover cells in the lungs.,arabic,1fa52c0ab836b90434d5028740bdf8c18906dec60b442f0960575a6a9239b6ab,Female,9.095999717712402,intron-MT,data/audio/intron/arabic/a66cd91f6e8bbf2cf22f290fa6fff683_dbPdUfoG.wav,/home/azureuser/gabby_data_mls/Intron-Multimodal-Benchmarking/
25537,لو عندك اسئلة تانية دلوقتي او بعدين متترددش تكتب لنا . هكون مبسوطة لو جاوبت على اسئلتك . خلي بالك من نفسك ,If you have additional questions or follow-up questions then please do not hesitate in writing to us.  I will be happy to answer your questionsTake care.,arabic,6504a007ccd20956a222bb08bb2fb38aeb4e5b49e3712d7c427adcffb5724671,Female,8.14799976348877,intron-MT,data/audio/intron/arabic/fe3a7302cb3461551998d0efb7115aa3_7lvNYlRt.wav,/home/azureuser/gabby_data_mls/Intron-Multimodal-Benchmarking/
17557,هو عمل التحليل وكان النتيجة سلبية. دلوقتي بعد ما صبغت شعري، بدأت تظهرلي حبوب صغيرة على فروة رأسي. هو قال لي إن ده مفيش منه مشكلة.,"He tested, it was negative.  Now, after I dyed I hair, I have been getting these little bumps on my head.  He told me it was fine.",arabic,ae36dfa6e11ad83b7151b14aaa198b9a6416d83b621a23cbd5cd9faf15ef08a4,Male,11.416000366210938,intron-MT,data/audio/intron/arabic/72ee40678676e9cf9f10c5f8685a8427_5x6g7YR5.wav,/home/azureuser/gabby_data_mls/Intron-Multimodal-Benchmarking/
25435,من حوالي 3 أسابيع، بعد ما جوزي أكل أجنحة حارة، جاله إسهال وشوية غثيان تاني يوم. كنا في إجازة وافتكرنا إنه جاله نزلة معوية.,About 3 weeks ago after eating some spicy wings my husband experienced diarrhea and some nausea the next day.  We were on vacation and thought he had gotten a stomach bug.,arabic,dea78bcf9400f8d589c46051967bcee0a88dd97b27c71441140ab39beec78f49,Female,10.050999641418457,intron-MT,data/audio/intron/arabic/536df8fb4866cc4a44e480e9a5a99c9b_n5qzLhN3.wav,/home/azureuser/gabby_data_mls/Intron-Multimodal-Benchmarking/
25671,مرحبًا. زوجي، الذي يبلغ من العمر 66 عامًا الآن، لاحظ مؤخرًا وجود كتلة في الجانب الأيمن من كيس الصفن بالقرب من ساقه. يقول إنها مؤلمة لكنه لا يريد رؤية أي شخص.,Hi. .my husband who is now 66 just noticed a lump on the ride side in the sac close to his leg.  He says its sore but doesnt want to see anyone.,arabic,1fa52c0ab836b90434d5028740bdf8c18906dec60b442f0960575a6a9239b6ab,Female,15.510000228881836,intron-MT,data/audio/intron/arabic/9031628ce778e6552185a7b5cca4e46b_GE0AvEtn.wav,/home/azureuser/gabby_data_mls/Intron-Multimodal-Benchmarking/
25482,مرحبًا سيدي، عمري 26 عامًا وأعاني من الصفير الشديد والعطس ونزلات البرد منذ عام 2007. طولي 5 أقدام و6 بوصات ووزني 70 كجم,"Hi sir, i'm 26 yr male suffering from heavy wheezing, sneezing and regular cold since 2007.my height is 5 feet 6inches and weight 70kg.",arabic,e0f859d3991d298d3f340515b7513dd27a4a552f271a768be2585c8897ab4317,Female,17.768999099731445,intron-MT,data/audio/intron/arabic/404d24f32f0eee30f1f887f03752bda8_EKjZCK7P.wav,/home/azureuser/gabby_data_mls/Intron-Multimodal-Benchmarking/
25523,"المشكلة موجودة منذ شهور، ولم يتمكن الأطباء من العثور على السبب (الجيوب الأنفية سليمة، إلخ). ما هذا، وماذا يمكنني أن أفعل لإيقافه؟

","The problem has been there for already for months and doctors can t find the reason (sinuses clear etc.).  What is this, what can I do to make it stop?",arabic,1f892f074f1b2258f70d45c545ac72a5fb0de0c9d4dc54eb08eb00166bba5add,Male,8.956000328063965,intron-MT,data/audio/intron/arabic/daf20253ff962e152e0643667fcf2a05_1p9JhoGj.wav,/home/azureuser/gabby_data_mls/Intron-Multimodal-Benchmarking/
25549,انا معنديش فكرة انا امتى هكون حامل .انا كمان مش راضية عن وزني دلوقتي ,I have no idea how long it is going to take for me to get pregnant.  I am also unhappy with my weight at the moment.,arabic,6504a007ccd20956a222bb08bb2fb38aeb4e5b49e3712d7c427adcffb5724671,Female,5.257999897003174,intron-MT,data/audio/intron/arabic/f9d5cf87d776469f2591cf5898dcea76_gov26YZJ.wav,/home/azureuser/gabby_data_mls/Intron-Multimodal-Benchmarking/
25598,"هل ممكن أتحكم في الموضوع عن طريق كوإنزيم Q10، الماغنسيوم، وتوت الهوثورن؟ ولو ممكن، الكميات قد إيه؟ أنا بفضل العلاجات الطبيعية بدل الأدوية.
أهلاً، شكرًا على طرح سؤالك.","Can it be controlled by Co10Q, magnesium and hawthorn berry? .. and what dosages?  I would rather do natural, than medications Hi Thanks for posting your query.",arabic,042ba3da2966afb60793ed8577c8387bda702a6da40d30750155eec9a7edd5fe,Female,18.065000534057617,intron-MT,data/audio/intron/arabic/751ad6997cde8f1f435bd2ad2914f7eb_DApujMgo.wav,/home/azureuser/gabby_data_mls/Intron-Multimodal-Benchmarking/
17537,وفي نفس الوقت، لو حصلت لك أي حالة تانية من انخفاض ضغط الدم، ممكن تقلل الجرعة للنصف في الوقت ده,"Meanwhile, if you have any further episode of low blood pressure, you can reduce the dosage to half at that point of time.",arabic,a00da6d7ad33ec156776bf66a72158043afb1c02387ab355024822ecdcd096cb,Male,11.645999908447266,intron-MT,data/audio/intron/arabic/2b76058734f903b93c99c3870f54d257_vJY4ie5d.wav,/home/azureuser/gabby_data_mls/Intron-Multimodal-Benchmarking/
17561,لو في ألم في الظهر فقط، ممكن تاخد قرص باراسيتامول حسب الحاجة، وهو آمن جدًا أثناء الحمل. كمان ممكن استخدام مرهم مسكن موضعي يساعد في التخفيف.,"If there is backache only, she can take tablet paracetamol as needed, it's quite safe in pregnancy.  Application of local pain reliever ointment can be of help.",arabic,ae36dfa6e11ad83b7151b14aaa198b9a6416d83b621a23cbd5cd9faf15ef08a4,Male,12.635000228881836,intron-MT,data/audio/intron/arabic/0dc0e882689342b11648c34266710b2d_gt1R5FjJ.wav,/home/azureuser/gabby_data_mls/Intron-Multimodal-Benchmarking/
25690,من شهر تقريبًا كنت بشتغل بعض الأشغال المكثفة في محل في التلاجات. كان الموضوع محتاج الكتير من السحب، والرفع، والتحريك السريع.,"About a month or so ago was doing some extensive work in a grocery store in the freezers.  Lots of pulling, lifting, and fast paced moving.",arabic,04280342e856481e1fd3c6fed4159259ed8a080619d1d1eec2a4011cd1b0e055,Female,11.958999633789062,intron-MT,data/audio/intron/arabic/8bc11f2575ad6fb7a24be26d0f636877_YtVoaJmz.wav,/home/azureuser/gabby_data_mls/Intron-Multimodal-Benchmarking/
25706,"عملت تخطيط عضلات، وقالولي إنها مش متلازمة النفق الرسغي. هكون شاكر لأي أفكار. أهلاً، شكرًا على سؤالك.

","Had an emg done and was told it was not carpel tunnel.  Any ideas would be appreciated Hi, Thanks for your query.",arabic,e317d0c45e4ff2f58f216abff134b8e0eee7f480875f66c61a3f0c699a4894cc,Female,8.890999794006348,intron-MT,data/audio/intron/arabic/512f091161c3965a4a5fa7e7be2b23d1_c0e203iH.wav,/home/azureuser/gabby_data_mls/Intron-Multimodal-Benchmarking/
25702,"نفسي أقدر أركز أكتر على اللي بعمله أو بتعلمه مع الوقت وأنا بكبر. شكرًا على أي نصيحة.

",I would like to be able to have better focus on what I am doing or learning as I mature.  Thanks for any advice.,arabic,e317d0c45e4ff2f58f216abff134b8e0eee7f480875f66c61a3f0c699a4894cc,Female,6.757999897003174,intron-MT,data/audio/intron/arabic/7da2da72f75b1bd3c4a0c35079d3fd90_GjMCvvru.wav,/home/azureuser/gabby_data_mls/Intron-Multimodal-Benchmarking/
25630,عندي وجع في أسفل بطني ناحية الشمال، والبراز طري مع إحساس بالاحتياج للحمام الصبح. تحليل البراز بيبين إنه نص مهضوم، ومفيش دم ولا طفيليات. السونار طلع طبيعي، لكن عندي الرحم مقلوب.,i have pain in lower left abdomen and soft stool and urging in morning.  stool test shows semidigested stool and no blood and parasite.  sonography normal but have retroverted uterus .,arabic,042ba3da2966afb60793ed8577c8387bda702a6da40d30750155eec9a7edd5fe,Female,16.812999725341797,intron-MT,data/audio/intron/arabic/b784aa12b21e99f6c7d4cd3c26b85b46_jkmGzL1r.wav,/home/azureuser/gabby_data_mls/Intron-Multimodal-Benchmarking/
17572,"بعد سنتين من ما جالها أزمة قلبية، بقت تعاني من نوع من الخرف، وبتتعصب جدًا لما حد يسألها عن صحتها.






","post 2 years of having a cva, she has a touch of dementia, she gets very mad when someone ask her a question about her health.",arabic,ae36dfa6e11ad83b7151b14aaa198b9a6416d83b621a23cbd5cd9faf15ef08a4,Male,7.690999984741211,intron-MT,data/audio/intron/arabic/e941dd1a3673c96f706fded41624929b_VmerBYx0.wav,/home/azureuser/gabby_data_mls/Intron-Multimodal-Benchmarking/
25692,عندها ألم شديد مستمر وقربت تستسلم. هو فيه مركز علاج أو حد لازم تروح له للمساعدة في دا؟,She is in constant severe pain and is about to give up.  Is there a treatment center or who should she see for help with this?,arabic,04280342e856481e1fd3c6fed4159259ed8a080619d1d1eec2a4011cd1b0e055,Female,8.569000244140625,intron-MT,data/audio/intron/arabic/2bc77f5e4a716af107fb596d0293f1ad_ov8oZ4Nb.wav,/home/azureuser/gabby_data_mls/Intron-Multimodal-Benchmarking/
17539,الحكاية دي حصلت لي قبل كده والدكتور اداني كريم احطه. الحاجة دي بدأت تظهر تاني يوم بعد الجري. عندك فكرة ليه ده بيحصل كتير؟,Ive had this before and my doctor gave me a cream to put on.  This occurrence started to appear a day after a run.  Any thoughts on why it continues to happen?,arabic,a00da6d7ad33ec156776bf66a72158043afb1c02387ab355024822ecdcd096cb,Male,13.916000366210938,intron-MT,data/audio/intron/arabic/dbb487f11a4ee4e98ae177cd69e0e114_FaezTvWH.wav,/home/azureuser/gabby_data_mls/Intron-Multimodal-Benchmarking/
17532,الحراره بتتراوح بين 99.9 لحد 101.9 بس مش بتزيد عن كدا .انا ادتها تايلينول و لكن حرارتها مش بتنزل ل99.0. هل الحمي دي بسبب التعرض للشمس ؟,It goes from 99.9 to 101.9 but not higher than that.  I gave her Tylenol but her temperature goes down to 99.0.  Is this fever caused by the sun exposure?,arabic,6757b2f7077bec53f7c77d25244249f12f66ae6c03fc3130030186554ce6edd2,Female,17.43000030517578,intron-MT,data/audio/intron/arabic/a2270ff145208a7bc4129196f972b762_B0Gx6yqM.wav,/home/azureuser/gabby_data_mls/Intron-Multimodal-Benchmarking/
17581,ما زلت انتظر موعد اخر مع الطبيب العام. هل يجب ان اقلق؟ قد يحدث نزيف تحت العنكبوتية بسبب انخفاض معدل ضربات القلبط لكن طبيب الاعصاب قال انه لا توجد مشكلة,I am still waiting another GP appointment.  Should I be worried?  Subarachnoid hemorrhage may because of low heart rate . but your Euro said no problem .,arabic,08850d12a85f1d1b10fbe6a65a5e7edeb9db2340922db0d287500d7c367eec0b,Male,16.81100082397461,intron-MT,data/audio/intron/arabic/d5b243cf949687ca4048c413310650fb_LIan9QyV.wav,/home/azureuser/gabby_data_mls/Intron-Multimodal-Benchmarking/
25438,أنا عندي رائحة فم كريهة من وانا صغير. دلوقتي عندي 33 سنة. بغسل أسناني كتير جدًا، بنضف لساني، وبستخدم غسول للفم. زُرت دكاترة أسنان كتير.,"I have bad breadth since my childhood.  Now i m 33 years old.I brush my teeth as many times as possible,clean my tongue,use mouthwash.I visited Dentists many times .",arabic,dea78bcf9400f8d589c46051967bcee0a88dd97b27c71441140ab39beec78f49,Female,13.583000183105469,intron-MT,data/audio/intron/arabic/1fc93a45103ac6a67df0b86e16257f5b_EYLRyg14.wav,/home/azureuser/gabby_data_mls/Intron-Multimodal-Benchmarking/
25509,انا عمري 29 سنة، وعندى ثلاثة أطفال، وأحتاج إلى إجابات. غادرت غرفة الطوارئ من غير تفسير أو تشخيص، فقط جرعتين من المضادات الحيوية. مرحبًا كايلا اموروس شكرًا على سؤالك.,"I am 29 years old, mother of 3, and need answers.  I left the ER with no explanation or diagnosis, just two antibotics.  Hi Kayla.amorous.  Thanks for your question.",arabic,722e67e779d93d4e975e39cbea3671c30d6effddd9e6e23274457522677f4291,Male,19.893999099731445,intron-MT,data/audio/intron/arabic/cdbb4bb854708d4490921bac9e9cae33_hJNTuxfs.wav,/home/azureuser/gabby_data_mls/Intron-Multimodal-Benchmarking/
17546,مرحبًا، في الفترة الأخيرة كنت حاسس بدوخة لعدة أسابيع، وحاسس إن توازني مش مظبوط، وأذني كانت حاسه كأنها محشية بالقطن، وكنت فاكر إني هافقد السمع.,"Hi I recently had several weeks of being dizzy,off balance, ears felt like they were stuffed with cotton I thought I was going deaf.",arabic,ae36dfa6e11ad83b7151b14aaa198b9a6416d83b621a23cbd5cd9faf15ef08a4,Male,12.27299976348877,intron-MT,data/audio/intron/arabic/c6682f2deb252b1692e5ecb6fadb180c_5sAVAGlr.wav,/home/azureuser/gabby_data_mls/Intron-Multimodal-Benchmarking/
