id,transcription,translation,language,speaker_id,gender,duration,source,audio_path,audio_root
24701,Morago ga diura di ka nna 6 o ne a tsoga a lela ka mantle a a metsi thata.  Fa ke leka go mo phimola a simolola go lela ka bogale mme di labia tsa gagwe di ne di le khibidu thata.,About 6 hours later she woke up crying with a very wet stool.  When I tried to wipe her clean she began crying sterically and her labia were very red.,tswana,d7b10750e88eddf3372b6cb3d8166d222f42fe0e92c5f1b3de72e15f52326483,Female,14.333000183105469,intron-MT,data/audio/intron/tswana/3905376cee177160694296003b256ca4_cS8LqHUG.wav,/home/azureuser/gabby_data_mls/Intron-Multimodal-Benchmarking/
27313,"Se se direlwa gore leino le seka la tlhola le nna botlhoko.Ka gore o sa ntse o utlwa botlhoko, se se raya gore modi wa leino ga o ise o wele go fola.","This is done so that the tooth does not pain anymore.  Since, you are experiencing pain, it means that the root canal treatment is not done completely.",tswana,c516cf7cd21764911b961a8652f91928daa9ce78380308abada02df52b01ba2a,Female,11.758000373840332,intron-MT,data/audio/intron/tswana/2cd5f513735e0e08d660f60448f7d368_6HTV5AT0.wav,/home/azureuser/gabby_data_mls/Intron-Multimodal-Benchmarking/
20179,Selo se ke amegile thata ka sone ke go nna le go rururga ga matlho ka ntlha ya go oketsega ga kgolokwe eno.A go ka direga gore tic e sa ntse ele ka fa tlase ga letlalo la me?,.My immediate concern is the bullseye rash with the increase in size of the lump.  is it possible the tic is still under my skin?,tswana,caa72fe67eb7b122416632ae84d2fc50a96ec13390c7328de5a9724946b3f6cd,Female,12.595000267028809,intron-MT,data/audio/intron/tswana/66aa2ffe50bea91df34325eb981de5b3_OQHnxaPu.wav,/home/azureuser/gabby_data_mls/Intron-Multimodal-Benchmarking/
19060,A go siame mme a o setse o kile wa bona go ruruga mo ditokololong tsa gago?,OK and have you noticed any swelling in your limbs?,tswana,8c18415398e3bc71cca7f2855255afd613bec45fe685e9bb8f7643f1e4953f71,Male,6.89300012588501,intron-MT,data/audio/intron/tswana/229e3da7c0c852b5703990e99a6f0cd4_eYuLcReT.wav,/home/azureuser/gabby_data_mls/Intron-Multimodal-Benchmarking/
24723,"Ke na le ditlhabi mo mpeng go tswa malatsing a le mane. E tla e tsamaya ka metlha, e simolola mo gare ga mpa mme e tsamaele kwa letlhakoreng le le siameng la mpa.",I am having abdominal pain from four days . its on and off it always starts from the middle of tummy and travels to the right side of stomach .,tswana,d7b10750e88eddf3372b6cb3d8166d222f42fe0e92c5f1b3de72e15f52326483,Female,11.243000030517578,intron-MT,data/audio/intron/tswana/0e53e66df9d446ffbc29d74c329671da_FLxtDOL8.wav,/home/azureuser/gabby_data_mls/Intron-Multimodal-Benchmarking/
24534,"Ke na le dingwaga di le 45, ke mosadi,  bokete ke 110 lbs, boleele ke 5'0. Matsatsing kena le bothata jwa go hema fa ke tsamaya.matsogo ame a botlhoko le sehuba same se botlhoko. ","I am 45, female, weight is 110 lbs, height is 5'0.  Recently I have difficulty breatng when I walk.my arms hurt and my chest hurts.",tswana,b4d9238dc092f37ddd32af4f6aa4cb81f65d335007837b617bae14f52ee7676a,Female,14.093999862670898,intron-MT,data/audio/intron/tswana/a5c39f73aa42a77c07d8c7a68cc38ebb_2X7T7z7U.wav,/home/azureuser/gabby_data_mls/Intron-Multimodal-Benchmarking/
19695,mme hagona ope yo o reeditseng.,But nobody listened.,tswana,e8f62cfa9c6229202d94437f436b3321cb9a7484ec536116991278b26278ce62,Female,3.244999885559082,intron-MT,data/audio/intron/tswana/072733be27d06cf9722b7d99b782d7f8_xegfTcwO.wav,/home/azureuser/gabby_data_mls/Intron-Multimodal-Benchmarking/
23643,"Ka mafoko a mangwe, ngaka e ka dira gore o se tlhole o utlwa botlhoko. Go a tšhesa le go opa. A go botoka go itshidila ka maatla, gongwe go dirisa message?","In other words can a Dr make it so it won t hurt anymore.  It burns and ackes.  Is it better to stretch it and force it, maybe message ?",tswana,677f10333e8e85969939f29bea6816b424ae5cf2a7eab466d66ed6cfba9aadb2,Female,14.163000106811523,intron-MT,data/audio/intron/tswana/5bc3e4a0a4e56ec29fc73e919e016a9e_T3Ttr1RL.wav,/home/azureuser/gabby_data_mls/Intron-Multimodal-Benchmarking/
20523,Gase mo bobokong fela mme letlhakore lotlhe la molema la sefatlhego. Raporoto ya sekene sa CT e kwadilwe kago latela,Not only in the brain but in complete left side of the face also.In the CT SCAN report it was written as follow:1.,tswana,5200301a262ca7b4233f4e227d0cb3ee1478a6c8652fc6bd8991cfce9db24404,Female,8.842000007629395,intron-MT,data/audio/intron/tswana/b3a5eac253c195cb7bb274e9abd2cf72_JUxsoJJy.wav,/home/azureuser/gabby_data_mls/Intron-Multimodal-Benchmarking/
20174,"Motlotlegi,ngwana wame wa dikgwedi dile robongwe o ne a wa mo bolaong mme o na le ntho e nnye mo letlhakoreng  la molema la tlhogo ya gagwe","Sir, my 9 month old child fell off the bed (2 and half feet high) and has got a small bump on the left side of his fore head.",tswana,caa72fe67eb7b122416632ae84d2fc50a96ec13390c7328de5a9724946b3f6cd,Female,10.187000274658203,intron-MT,data/audio/intron/tswana/bd5bcda0c7338e6151125567045d622d_smEqpSGm.wav,/home/azureuser/gabby_data_mls/Intron-Multimodal-Benchmarking/
21288,"Ee, ko ntle ga botlhoko mo sehubeng, a o ikutlwa o na le dikai tse dingwe gape jaaka go felelelwa ke mowa?","OK, apart from this chest pain, have you, have you been feeling any other symptoms like shortness of breath?",tswana,94085e89a9823174a44230b6150483aceaf0075faf1ca155f297b504dd7cf23f,Female,6.577000141143799,intron-MT,data/audio/intron/tswana/9674fc0ce4696b7f1d481f6e3da95904_QWSfcYp4.wav,/home/azureuser/gabby_data_mls/Intron-Multimodal-Benchmarking/
27125,Botlhole jwa seporei sa dikhukhwana. Malatsi a le mabedi a fetile. Letsatsi la ntlha o kgwa gangwe morago ga diura di le nne tsa go metsa mme a nna le mantle a a lolea makgetlo a le mabedi. Palo e ne e le kwa tlase. Letsatsi la bobedi ga gona sepe se se diragetseng fa e se setlhabi sa sehuba sa mo mojeng.,Bug spray poisoning.  2 days gone.  1st day vomited once after 4 hours of ingestion and had loose stool 2 times.Amount was less.  2nd day nothing happened except right side chest pain.,tswana,87f8b5f1bf8ca92ef03569d7ec7991a96e27a0b6c266ccddd2b091c9c6b270c6,Female,21.152999877929688,intron-MT,data/audio/intron/tswana/c23d350dc2a0aa5e86a4fb8472f461db_UbIjLeRn.wav,/home/azureuser/gabby_data_mls/Intron-Multimodal-Benchmarking/
21567,A go setse go kile ga diragala mo go wena mo nakong e e fetileng?,Has this ever happened to you before?,tswana,ce4b62b0368a7a7af72e4164bdc4780a43b088b94cbed37129b725c16361173a,Female,3.5309998989105225,intron-MT,data/audio/intron/tswana/fd96a2338b956d3e05e75e4aee277206_EiZAw9Vg.wav,/home/azureuser/gabby_data_mls/Intron-Multimodal-Benchmarking/
25760,"Ke na le dialeji mme go go kile ga nna maswe jaana, Degree tlhaloganya matshwenyego a gago a ne a feta ka dintlha tsa gago. Ke go akantsha gore o se ka wa tshwenyega thata.","I have allergies but there ever this bad, Degree understand your concerns went through your details.  I suggest you not to worry much.",tswana,12d5fd9ff0d9e7a3b46b51788b6178b440440e0a6c947c3e6cf1c628b62c90ae,Female,12.340999603271484,intron-MT,data/audio/intron/tswana/b53d50bb54f583964568af7d324053c7_7rnEt1XK.wav,/home/azureuser/gabby_data_mls/Intron-Multimodal-Benchmarking/
27392,"Ke tlile go dira tlhatlhobo e nngwe gape ka moso go bona gore a follicle ya me e a phatloga, fa go sa nna jalo ke tlile go fiwa lomao. A ga go ise go nne thari mo ngwageng ono","i will have again another scan tomorrow to see if my follicle rupture, if not an injection will be given to me. is it not too late for this cycle?",tswana,f9d04f28ab40492fdd8eb3ca8ce9f42054e8e84df68ad8429cae104fe82f08c3,Female,12.13700008392334,intron-MT,data/audio/intron/tswana/c61ff06bc55d27f5c6819aab507440d9_dKFnS6J4.wav,/home/azureuser/gabby_data_mls/Intron-Multimodal-Benchmarking/
22630,O ne a dira jaana dikgwedi tse di boferabobedi tse di fetileng le fa nne go etla go tsamaya morago go boa (mo sebakeng sa beke fela) mo sebakeng sa kgwedi mme a bo a siama dikgwedi tse di boferabobedi tse di fetileng.,about 8 months ago she did this on and off (once a week) for about a month but then was fine for the 8 months.,tswana,c516cf7cd21764911b961a8652f91928daa9ce78380308abada02df52b01ba2a,Female,13.29699993133545,intron-MT,data/audio/intron/tswana/b2c52d936e692a672df948dcae1adf2d_km8gcTBj.wav,/home/azureuser/gabby_data_mls/Intron-Multimodal-Benchmarking/
21738,go babalesegile go tsaya gore o batla go boloka boimana jono. Boimana jono bo a batlega.,it's safe to assume that you want to keep this pregnancy. This pregnancy is desired.,tswana,2ea628ce94e818c3f28822ee2155c73efba7ba816c81f8d2da6252227575c58b,Female,7.828999996185303,intron-MT,data/audio/intron/tswana/81e35679f2d7feefe9b76b6132f65992_99kwoB7s.wav,/home/azureuser/gabby_data_mls/Intron-Multimodal-Benchmarking/
24605,"Gape mabele a me a utlwa botlhoko fa ke a tshwara mo mafelong mangwe, a ke tshwanetse go tshwenyega mme seo se raya eng? Re lebogela potso ya gago mo Chat Doctor. ",", also my boobs kinda hurt when i touch them in certain areas , should I be worried and what does ts mean ?  Thanks for your question on Chat Doctor.",tswana,21cc435f42d0d9535ff6de2f90a7576fe183fdebe4d2a77626dde7653d6029de,Female,11.869999885559082,intron-MT,data/audio/intron/tswana/bf706da93acec2ef54f0274d0dfa145a_85UuvKrr.wav,/home/azureuser/gabby_data_mls/Intron-Multimodal-Benchmarking/
24168,Go nwa Molemo wa Letshoroma go tswa mo malatsing a le 15 a a fetileng. Fa ke nwa melemo ya letshoroma keya siama. Mme morago ga diura di le mmalwa ke ikutlwa ke na le letshoroma gape. Tsweetswee gakolola,Taking Medicine of Fever from last 15 days.  When I take medicine of fever then I am ok. but after few hours feeling feverish again.  Please advise,tswana,12d5fd9ff0d9e7a3b46b51788b6178b440440e0a6c947c3e6cf1c628b62c90ae,Female,14.704000473022461,intron-MT,data/audio/intron/tswana/bda6d3edad46006676172a3376764723_hGqTKuKr.wav,/home/azureuser/gabby_data_mls/Intron-Multimodal-Benchmarking/
18166,"Ke ne ke ntsha dilo dingwe mo serotong sa koloi ya me, mme ne ga simolola go nna botlhoko.","I was lifting some things out of the trunk of my car, and it started hurting.",tswana,94085e89a9823174a44230b6150483aceaf0075faf1ca155f297b504dd7cf23f,Female,6.160999774932861,intron-MT,data/audio/intron/tswana/a88b98a02ea1ef7a0103b0f778681544_11JTCZC1.wav,/home/azureuser/gabby_data_mls/Intron-Multimodal-Benchmarking/
20183,"A o ka nthusa ke bone tshedimosetso e e botoka fa ke le kwa Bangalore ,kwa India. ke tlhaloganya gore o tshwenyegile ka dintlha tsa gago.Ke go gakolola gore o seke wa tshwenyega thata",Could you please assist me where can i get better information and preferably in bangalore location --India.  Degree understand your concerns went through your details.  I suggest you not to worry much.,tswana,caa72fe67eb7b122416632ae84d2fc50a96ec13390c7328de5a9724946b3f6cd,Female,11.321000099182129,intron-MT,data/audio/intron/tswana/e0d45a3b44a6110b3810df736bf2157e_Z9sD1cF5.wav,/home/azureuser/gabby_data_mls/Intron-Multimodal-Benchmarking/
23487,"Ke go gakolola o tle o kgone go ithuta di follicle ka letsatsi la 10 go ya go 20 mo cycle e e latelang, seno se tla go thusa go itse ka ga letlha la go bopega ga lee.","I will suggest you to get follicle study from day 10 to 20 of the next cycle, this will help to know about the date of egg formation.",tswana,677f10333e8e85969939f29bea6816b424ae5cf2a7eab466d66ed6cfba9aadb2,Female,14.737000465393066,intron-MT,data/audio/intron/tswana/23bea4c0db76cbf4f277337be243989b_k01AhnAN.wav,/home/azureuser/gabby_data_mls/Intron-Multimodal-Benchmarking/
20184,Botlhoko bo nna bogolo fa a bula molomo wa gagwe thata mme a utlwa modumo wa go phatloga ga lerama la gagwe la moja.Gape o utlwa botlhoko mo lefelong la meno a gagwe a moja.,The pain is more when she wide opens her mouth and she feels the little crackling sound around her right cheek.  She also feels pain in the right teeth area.,tswana,caa72fe67eb7b122416632ae84d2fc50a96ec13390c7328de5a9724946b3f6cd,Female,12.25,intron-MT,data/audio/intron/tswana/c078f7696424a3317e620d0d3a9f0ae0_ZaNXgE0x.wav,/home/azureuser/gabby_data_mls/Intron-Multimodal-Benchmarking/
21664,"Ee, go siame. A go na le tshololo epe e e tswang mo lebeleng la gago? A go na le sengwe se se ntseng jalo?","Yeah, OK. Any discharge from your breast? Anything like that?",tswana,acba33ac6c0d555e6faaa4eafd6de9bf3ac045e448aafcd1aab72177f9784d5c,Female,7.999000072479248,intron-MT,data/audio/intron/tswana/1b4ccbffb2babb75d79c4d260af1d567_7ZJIEz7Z.wav,/home/azureuser/gabby_data_mls/Intron-Multimodal-Benchmarking/
24930,One anteka Jang gore kenale dibakateria tse disenang diteko tsa Madi -one  areetsa sehuba same Mme a Leba mokgogotsong yame?,How did she diagnose me as bacterial with no blood tests - just listned to my chest and looked in my throat ?,tswana,8f0330cd8c1712c8699c8504f5bf2d47749db600d23a97fa8bd1063114dad2cb,Female,9.979999542236328,intron-MT,data/audio/intron/tswana/fd82479b78acecd09995a3a07ae4c4b2_MpsgKGCU.wav,/home/azureuser/gabby_data_mls/Intron-Multimodal-Benchmarking/
21667,"Go tweng ka bojalwa, a o nwa bojalwa?","How about alcohol, do you drink alcohol?",tswana,acba33ac6c0d555e6faaa4eafd6de9bf3ac045e448aafcd1aab72177f9784d5c,Female,3.4670000076293945,intron-MT,data/audio/intron/tswana/f4fe0cec3baa2a2806818924b675c2ad_Evdlvbwt.wav,/home/azureuser/gabby_data_mls/Intron-Multimodal-Benchmarking/
26829,"Ke ntse ke nale le mathata a sinus le go hema sentle ka dikgwedi di le pedi. Beke e e fiteleng , ke lemogile gore go na le lotshitshi lo lo ntse mo ntlong.",I have been having sinus and respiratory problems for a about 2 months.  I discovered a large amount of mold in the house this past week.,tswana,80dcf18981f22cd28eb49db040dacd2c18238c57d09ad5e35927e350eca33bb9,Female,12.942999839782715,intron-MT,data/audio/intron/tswana/db20862134d217734863e777e56af495_Fl2TZi6j.wav,/home/azureuser/gabby_data_mls/Intron-Multimodal-Benchmarking/
19263,"Ke nna le peine e e bogale thata mo mpeng ya me e e fa godimo fa ke inama go ya pele.  E utlwala e le ya metšhine, jaaka e kete go na le sengwe se se tshwerweng.","I have a very sharp linear pain in my upper abdomen when I bend forward.  It feels mechanical, as though sometng is being trapped.",tswana,1c646e2c8c6f5a1b527abff0a2eebb12cc3bcd066c25c25252a75f36a8637bca,Female,14.383000373840332,intron-MT,data/audio/intron/tswana/feefcea04dd9a39ad669427073d0f983_CPZmQLJx.wav,/home/azureuser/gabby_data_mls/Intron-Multimodal-Benchmarking/
26826,"Dibeke tse pedi  morago ga go tlhosiwa, ga se bopobo, ke ne ka utlwa botlhoko jo bo masisi mo letlhakoreng le le kwa godimo la moja le kwa morago mo mokwatleng, gape ka tlhatsa selo se se boputswa.",2 weeks after the gallbladder was removed i had the severe pain in my right upper quad and all the way around to my back plus vomiting a grey substance.,tswana,80dcf18981f22cd28eb49db040dacd2c18238c57d09ad5e35927e350eca33bb9,Female,14.638999938964844,intron-MT,data/audio/intron/tswana/0e6f3f72e56d81c3c8a68cd1aa4651e2_4RJHg7Aw.wav,/home/azureuser/gabby_data_mls/Intron-Multimodal-Benchmarking/
22483,Go diragetsi fela jaalo le ka loleme la gago.Ka jalo o seka wa nna thata mo go yone.Go tlhobaela ga gago go bakwa ke go akanya ka tsela e e seng ya mantota.Kalafi ya tlhaloganyo e go tshwanela thata.,The same has happened with your tongue.  So don't dwell too much into it.  Your anxiety is due to unrealistic thinking.  Cognitive therapy is best suited for you.,tswana,62f1b3f108425ae1bcd6a964eda844ddc87824f4546bd701c0503b9b6978641e,Female,14.307999610900879,intron-MT,data/audio/intron/tswana/623cf8801b527380c89c4f1ff30fd4f0_o9JDFluV.wav,/home/azureuser/gabby_data_mls/Intron-Multimodal-Benchmarking/
21588,"Boa gape, ngaka. Ga ke kgone go go utlwa.","Come again, doctor. I can't hear you.",tswana,ce4b62b0368a7a7af72e4164bdc4780a43b088b94cbed37129b725c16361173a,Female,3.1410000324249268,intron-MT,data/audio/intron/tswana/918c2c6914585c627f35c6e28a094563_pkH5OjE5.wav,/home/azureuser/gabby_data_mls/Intron-Multimodal-Benchmarking/
16620,A go na le ditlamorago dingwe go feta foo tsa LONAZAP. Re direla kwa India. Ebile re a go amogela mo go tlotleng ngaka. Ke lebogela potso ya gago.,Is there any side effects of the LONAZAP further.  We are based in India.  and welcome to Chat Doctor.  Thanks for your question.,tswana,94085e89a9823174a44230b6150483aceaf0075faf1ca155f297b504dd7cf23f,Female,11.5,intron-MT,data/audio/intron/tswana/adbc826e821b476a06f3a7e9114124ca_WIiZuPAt.wav,/home/azureuser/gabby_data_mls/Intron-Multimodal-Benchmarking/
24823,"gase bothata bo bo tlhwafetseng, mme bo nnete go tlhoka kalafi e tshwanetseng. A one ona le mefikela kana borurugo go dikologa ditsebe? ","It is not a serious problem, but surely needs appropriate treatment.  Did u have any fever or a swelling around your ears ?",tswana,e04705562016c89b2b6ad46e5f93f9e243801f3008f8f2bd6bdf47a61cd0fd75,Female,10.807999610900879,intron-MT,data/audio/intron/tswana/8984b6fb0c8a55188a0f7bf8f210e371_RerRTEOr.wav,/home/azureuser/gabby_data_mls/Intron-Multimodal-Benchmarking/
24699,Thupelo ya ntlwana ya boithomelo - ke gore - go nna mo mofuteng wa ntlwana ya boithomelo ya India letsatsi le letsatsi ka nako e le nngwe go tla thusa thata.  Ke solofela karabo yame e go thusitse.,Toilet training - that is - sitting in Indian type of lavatory daily at the same time will help a lot.  Hope my answer was helpful for you.,tswana,d7b10750e88eddf3372b6cb3d8166d222f42fe0e92c5f1b3de72e15f52326483,Female,12.875,intron-MT,data/audio/intron/tswana/3adf8c941ffc00ada8b6fd7b5f9b6869_W5J0cWn7.wav,/home/azureuser/gabby_data_mls/Intron-Multimodal-Benchmarking/
16619,"Ke nnile le go ntsha popelo mo go feletseng ka kgwedi ya Tlhakole mo neng go butswe mo lebading la go segwa ga pelegi go tswa ka ngwaga wa 1987 go ya kwa go wa 1989. Ga ke sa tlhola ke na le go tswa Madi. Ga gona bolwetsi jwa popelo jo bo
 fitlhetsweng.",I had complete abdominal hysterectomy last February wch was opened on my old c section incision from 1987 and 1989.I no longer have the bleeding.  No endimetriosis was found.,tswana,94085e89a9823174a44230b6150483aceaf0075faf1ca155f297b504dd7cf23f,Female,19.545000076293945,intron-MT,data/audio/intron/tswana/cec0838835320005d391073be57b8a74_Ui4WNKdz.wav,/home/azureuser/gabby_data_mls/Intron-Multimodal-Benchmarking/
22686,Bontsi jwa di tibial plateau tse di robegileng ka kakakretso di fola sentle mo dibekeng tse 6 go ya go tse 8. Ngaka ya gago e tla dira ditlhatlhoo gangwe le gape mo dibekeng tse 1 go ya go tse pedi go itse boitekanelo le pholo ya lerapo.,Most of the tibial plateau fracture generally heal well in 6-8 weeks time.  Your doctor will do frequent x-ray examination in 1-2 weeks to know the health of healing bone.,tswana,677f10333e8e85969939f29bea6816b424ae5cf2a7eab466d66ed6cfba9aadb2,Female,19.131999969482422,intron-MT,data/audio/intron/tswana/1ac6c2435ad780bfe7bcff2903c2660b_Hmr4nfAX.wav,/home/azureuser/gabby_data_mls/Intron-Multimodal-Benchmarking/
17022,"Uh jaanong ke tshotse ka sekere fa kele dingwageng  dile masome  ale mabedi.Um  ke ne ke fetsa uh mengwageng ele metlhano e fetilego,kene ka tlosiwa kgala.ok","Uh so I had a C-section in my twenties.  Um then I had just uh five years ago, I had a um my gallbladder removed.OK.",tswana,caa72fe67eb7b122416632ae84d2fc50a96ec13390c7328de5a9724946b3f6cd,Female,13.442999839782715,intron-MT,data/audio/intron/tswana/00958fff523e915d50c69305d5b230cc_jEpBrZVg.wav,/home/azureuser/gabby_data_mls/Intron-Multimodal-Benchmarking/
22626,Ke tlhoka  kitso ya gore se ke eng. Go tla ama botsogo jwame jang fa ke le dingwaga tse 20 ebile ke eng ke tlhoka go dirisa pacemaker. Kea leboga ,im looking for some info on what exactly this is. how it will effect me at 20 and why on earth would i need a pacemaker.  thank you.,tswana,c516cf7cd21764911b961a8652f91928daa9ce78380308abada02df52b01ba2a,Female,10.42300033569336,intron-MT,data/audio/intron/tswana/378d07f500cbd3b0bfcc75fc3dfdc658_vbVdVNml.wav,/home/azureuser/gabby_data_mls/Intron-Multimodal-Benchmarking/
22632,"Dumela kea tsietsega , ke lebogela gore o postile. Ke bone ngongora ya gago ebile ke tlhaloganya matshwenyego a gago. Dikai tsa gago di supa fa o tshwenngwa ke herniated disc.","i am confused Hi, thank you for posting!  I have gone through your query and I understand your concerns.  Your symptoms tell that you suffer from herniated disc.",tswana,c516cf7cd21764911b961a8652f91928daa9ce78380308abada02df52b01ba2a,Female,12.442999839782715,intron-MT,data/audio/intron/tswana/6f5397235e4162d6f25ebb7bed8a918a_VKQgQjlW.wav,/home/azureuser/gabby_data_mls/Intron-Multimodal-Benchmarking/
16487,"Ngaka ya me ya GI e kgaphetse kwa thoko tlhokego ya ERCP, e bolela gore ka gonne selekanyo sa me sa amylase le lipase se tlhomame le dikotsi tsa teko dile dintsi thata","My GI doctor has ruled out the need for an ERCP, claiming that because my amylase and lipase levels are steady and the risks for the test are too gh.",tswana,d06a794a0e58ca0cc635b8d53a868bd8a6fd57348c79888cad9fb7aae1072d6f,Female,18.45599937438965,intron-MT,data/audio/intron/tswana/73feff22234221423badb88098d97caa_Xi46sb7i.wav,/home/azureuser/gabby_data_mls/Intron-Multimodal-Benchmarking/
22621,"A metsi fela thata ebile o ntse a kgwa go fitlha le mo letsatsing la bofelo, o tlhatsitse makgetlho a ka nna thataro kana bosupa. Ok, o tlhatsitse makgetlho a ka nna kafe?","It's definitely just very very watery and he's had to go probably even just in the last day, probably around like six or seven times.OK, um, and he's vomited how many times?",tswana,c516cf7cd21764911b961a8652f91928daa9ce78380308abada02df52b01ba2a,Female,14.413000106811523,intron-MT,data/audio/intron/tswana/e7b9a5c96b294e439f19110bc3429d7a_adS8OtdY.wav,/home/azureuser/gabby_data_mls/Intron-Multimodal-Benchmarking/
16507,Ts e tla bontsha fao na le di phetogo tsa go gola mo molaleng wa gago tse di ka dirang gore o utlwe botlhoko jo o bo utlwang. Fola ka pele.,Ts will show if there are any aging changes in your neck that may be responsible for the pain you are feeling.  Get well soon.,tswana,a3c73bad0d37a2c6e2819ea89c8401846decfdd98ae892cd1e02cbdda7c78400,Female,10.012999534606934,intron-MT,data/audio/intron/tswana/6156e067eae9e72fdd63571af21ea744_LxF16I7d.wav,/home/azureuser/gabby_data_mls/Intron-Multimodal-Benchmarking/
16488,O tshwanetse go nna le tshedimosetso e e tseneletseng.  Go sa nne le mogopolo ke selo se sengwe mme go tsamayatsamaya mo mogopolong ke selo se sengwe.  Ke tlile go kgona go araba potso eno ka kakaretso.,You should be more elaborate.  Being absent-minded is one tng and wandering mind is another.  I shall be able to answer ts question in a general manner.,tswana,d06a794a0e58ca0cc635b8d53a868bd8a6fd57348c79888cad9fb7aae1072d6f,Female,16.94300079345703,intron-MT,data/audio/intron/tswana/5d22fa4ac29d46e5cd8878a62d04c329_shq2doAD.wav,/home/azureuser/gabby_data_mls/Intron-Multimodal-Benchmarking/
16526,"Ke kgona go tlhaloganya bothata jwa gago, fa o newa kalafi e nngwe, morago ga go nna le karabo e e siameng ka karo e e fetileng.","I can understand your dilemma, when you are offered another treatment option, after having had a good response with the previous surgery.",tswana,10d1a2ba07777b7a0cdd2e2826bf6f7d5fbcc1ac25b42197bde26acc0e25b074,Female,12.293999671936035,intron-MT,data/audio/intron/tswana/1c0d40ae85d0a419459ba67475d2a876_Amu3qc8O.wav,/home/azureuser/gabby_data_mls/Intron-Multimodal-Benchmarking/
17021,"diteko tsa gagwe di kaya  a tshwere ke tshwaetso ya ameobic .Fela ke bone gore madi  fa a tlhakana le mantle,Go bonagala fa gonna jaaka madi a siameng.","He is showing positive tests for ameaboic infection.  but i find that blood is not mixed in the stools , it appears to me like fresh blood.",tswana,caa72fe67eb7b122416632ae84d2fc50a96ec13390c7328de5a9724946b3f6cd,Female,12.961000442504883,intron-MT,data/audio/intron/tswana/d1ec837d65638eef069ea88f2a3a5636_bry4ScWI.wav,/home/azureuser/gabby_data_mls/Intron-Multimodal-Benchmarking/
21638,Nnyaa gotlhegotlhe. Ga o a tsewa ke sedidi.,Not at all. No dizziness.,tswana,acba33ac6c0d555e6faaa4eafd6de9bf3ac045e448aafcd1aab72177f9784d5c,Female,3.3350000381469727,intron-MT,data/audio/intron/tswana/c5c6a6bafd6b0be7e14e762d454eb6dc_PVpYPisc.wav,/home/azureuser/gabby_data_mls/Intron-Multimodal-Benchmarking/
24864,Kiti ni vigumu kupita hata wakati ni laini.  Daima lazima ufadhaike na usipite kiasili.  Najua nina kovu ngumu.,Stool is difficult to pass even when soft.  Always have to strain and never passes naturally.  I know I have a hard scar tissue.,tswana,99e6248986f541151a2fdd66a0de66847d0ba4c0fc07e072d64c127230c76ab4,Female,20.573999404907227,intron-MT,data/audio/intron/tswana/ae55fb8d51482a0ca79e183764ffe724_EfpoT2DT.wav,/home/azureuser/gabby_data_mls/Intron-Multimodal-Benchmarking/
24875,"p ubuhlungu, emisebeni eya kuma-testis kungabangelwa nje ukutheleleka komgudu womchamo, amatshe omgudu womchamo, ukuvuvukala kwama-testis noma ukuvuvukala kwendlala yesinye.","p pain, radiating to the testis can be simply caused by urinary tract infection, urinary tract stones, testis inflammation or prostate inflammation.",tswana,99e6248986f541151a2fdd66a0de66847d0ba4c0fc07e072d64c127230c76ab4,Female,28.57200050354004,intron-MT,data/audio/intron/tswana/8e2030cca372b34b59d9be6245b79e3c_UuSBUtLL.wav,/home/azureuser/gabby_data_mls/Intron-Multimodal-Benchmarking/
22266,"Dumela,O amogetswe go Bua ke sekasekile ditletlebo tsa gago ka botlalo.Typhoid ke bacterial infection e e nnang mo mmeleng go fitlhela e alafiwa mo bathong ba bang.","Hello, Welcome to Chat I have gone through your query in detail.  Typhoid is a bacterial infection and stays in the body till treated completely in most individuals.",tswana,d2963ea914af495ffc621e5bce1cc3aacb7069e953291f8acf6fbabfbf922be9,Female,10.99899959564209,intron-MT,data/audio/intron/tswana/a07814d09cd1cb8ed696bb0cb2024a35_W6PGsBFJ.wav,/home/azureuser/gabby_data_mls/Intron-Multimodal-Benchmarking/
